{
  "$schema": "../schemas/beta-readiness.schema.json",
  "schema_version": "1.0.0",
  "readiness_status": "blocked",
  "session_id": "AURA-SP-032-FINAL-RECONCILIATION-20260902",
  "authority": {
    "mode": "current_session_edit_only",
    "beta_enrollment": false,
    "telemetry_activation": false,
    "app_install_or_launch": false,
    "release": false
  },
  "dependency_gate": {
    "r11_state": "completed",
    "r11_release_status": "development_unverified",
    "r11_completion_required": true,
    "r11_evidence_id": "EV-SP-032-20260903-R11-SYNTHETIC-LIFECYCLE-01"
  },
  "cohort": {
    "status": "enrolled",
    "type": "internal_local_single_participant",
    "consent": "collected",
    "consent_evidence_id": "EV-SP-030-20260830-OWNER-APPROVAL-03",
    "participants": 1,
    "minimum_sessions": null,
    "supported_profiles": [
      "clean_profile",
      "configured_profile"
    ]
  },
  "capability_scope": {
    "included": [],
    "excluded": [
      "real_wake_word",
      "neural_voice",
      "mail_send",
      "plugins",
      "remote_agents",
      "signed_updates",
      "launch_at_login"
    ],
    "rationale": "No beta capability is enabled before its direct gate passes. Computer use is enabled for LOCAL use only under ADR-055 (owner-directed risk acceptance, 2026-09-07); the external-beta scope is unchanged because external release remains out of scope under ADR-049, and launch_at_login keeps its confirmation gate."
  },
  "telemetry": {
    "enabled": false,
    "consent_required": true,
    "raw_content_allowed": false,
    "transport": "none",
    "retention_days": null,
    "aggregate_fields": [
      "session_outcome",
      "latency_percentiles",
      "confirmation_outcome",
      "recovery_outcome",
      "resource_pressure_class"
    ]
  },
  "slo_definitions": [
    {
      "id": "ptt_ack",
      "metric": "push_to_talk_acknowledgement_ms",
      "percentiles": [
        50,
        95,
        99
      ],
      "target_ms": null,
      "sample_minimum": null,
      "status": "not_measured"
    },
    {
      "id": "stt_partial",
      "metric": "first_stt_partial_ms",
      "percentiles": [
        50,
        95,
        99
      ],
      "target_ms": null,
      "sample_minimum": null,
      "status": "not_measured"
    },
    {
      "id": "dialogue_first_token",
      "metric": "local_dialogue_first_token_ms",
      "percentiles": [
        50,
        95,
        99
      ],
      "target_ms": null,
      "sample_minimum": 20,
      "status": "measured",
      "measurement": {
        "evidence_id": "EV-SP-030-20260830-HARNESS-MEASUREMENT-02",
        "measurement_class": "deterministic_harness",
        "sample_count": 30,
        "percentiles_ms": {
          "50": 38.9,
          "95": 40.1,
          "99": 41.1
        },
        "live_beta_sample": false,
        "limitations": "LOWER BOUND, NOT THE FULL METRIC. This measures only the local Ollama first-token leg over loopback (127.0.0.1:11434, streaming, warm resident model); it EXCLUDES AURA's in-app routing, NLU, policy evaluation and UI render, all of which sit between the user and the first visible token. The user-observed local_dialogue_first_token_ms is therefore strictly larger than these numbers and remains unmeasured. Model: hf.co/GnLOLot/MiniCPM5-1B-...-GGUF:Q8_0 (1.3 GB, 100% GPU) — a 1B model, not necessarily the model the product routes to; the value is model-dependent. granite4.2:8b (5.3 GB) was attempted first and failed to return a first token within a 900 s warmup, so an 8B-class figure could not be obtained. No target is asserted and no pass/fail is claimed. 30 samples after a discarded warmup."
      }
    },
    {
      "id": "false_success",
      "metric": "false_success_rate",
      "percentiles": [],
      "target_ms": null,
      "sample_minimum": 5,
      "status": "measured",
      "measurement": {
        "evidence_id": "EV-SP-030-20260830-HARNESS-MEASUREMENT-01",
        "measurement_class": "deterministic_harness",
        "sample_count": 9,
        "value": 0.0,
        "live_beta_sample": false,
        "limitations": "Sample is the 9 verification-bearing cases in SP014LiveAcceptanceTests (5) and SP016BilingualFailClosedTests (4), which assert a claimed success matches observed reality. Deterministic harness coverage from the 2026-08-30 full-suite run (1290 tests, 22 bundles, 0 failures). This is NOT a live user-present beta window and NOT a live-microphone result. Recorded as a single aggregate proportion (0/9); per-session p50/p95/p99 require a live multi-session beta window and are not claimed here."
      }
    },
    {
      "id": "unauthorized_action",
      "metric": "unauthorized_action_count",
      "percentiles": [],
      "target_ms": null,
      "sample_minimum": 50,
      "status": "measured",
      "measurement": {
        "evidence_id": "EV-SP-030-20260830-HARNESS-MEASUREMENT-01",
        "measurement_class": "deterministic_harness",
        "sample_count": 255,
        "value": 0,
        "live_beta_sample": false,
        "limitations": "Sample is the 255 adversarial/policy cases in AuraAdversarialTests (68), AuraPolicyTests (39), AuraComputerUseTests (104) and AuraSecurityTests (44). Zero unauthorized actions were observed. Deterministic harness coverage from the 2026-08-30 full-suite run (1290 tests, 22 bundles, 0 failures). This is NOT a live user-present beta window and NOT a live-microphone result."
      }
    }
  ],
  "scenario_matrix": [
    {
      "id": "turkish_english_mixed",
      "status": "passed",
      "evidence_ids": [
        "EV-SP-030-20260830-HARNESS-MEASUREMENT-01"
      ],
      "measurement_class": "deterministic_harness",
      "limitations": "SP003LiveBilingualDialogueScenarios, SP016BilingualFailClosedTests, TurnCompletionHeuristicsTests. Deterministic harness coverage from the 2026-08-30 full-suite run (1290 tests, 22 bundles, 0 failures). This is NOT a live user-present beta window and NOT a live-microphone result."
    },
    {
      "id": "permission_denial_revocation",
      "status": "passed",
      "evidence_ids": [
        "EV-SP-030-20260830-HARNESS-MEASUREMENT-01"
      ],
      "measurement_class": "deterministic_harness",
      "limitations": "SP006LiveCapabilityScenarios and the AuraPolicyTests revocation cases. Deterministic harness coverage from the 2026-08-30 full-suite run (1290 tests, 22 bundles, 0 failures). This is NOT a live user-present beta window and NOT a live-microphone result."
    },
    {
      "id": "offline_backend_unavailable",
      "status": "passed",
      "evidence_ids": [
        "EV-SP-030-20260830-HARNESS-MEASUREMENT-01"
      ],
      "measurement_class": "deterministic_harness",
      "limitations": "AgentBackendHealthTests, RuntimeHealthTests and SP014LiveAcceptanceTests P3. Deterministic harness coverage from the 2026-08-30 full-suite run (1290 tests, 22 bundles, 0 failures). This is NOT a live user-present beta window and NOT a live-microphone result."
    },
    {
      "id": "task_helper_crash_recovery",
      "status": "passed",
      "evidence_ids": [
        "EV-SP-030-20260830-HARNESS-MEASUREMENT-01"
      ],
      "measurement_class": "deterministic_harness",
      "limitations": "HelperIPCAdversarialTests, SP016DeviceRecoveryTests, AuraLifecycleTests SafeModeTests/LifecycleObserverTests. Deterministic harness coverage from the 2026-08-30 full-suite run (1290 tests, 22 bundles, 0 failures). This is NOT a live user-present beta window and NOT a live-microphone result."
    },
    {
      "id": "injection_emergency_stop_accessibility",
      "status": "passed",
      "evidence_ids": [
        "EV-SP-030-20260830-HARNESS-MEASUREMENT-01"
      ],
      "measurement_class": "deterministic_harness",
      "limitations": "PromptInjectionAdversarialTests (19), EmergencyStopControllerTests (4), AuraAccessibilityIdentifierTests. Deterministic harness coverage from the 2026-08-30 full-suite run (1290 tests, 22 bundles, 0 failures). This is NOT a live user-present beta window and NOT a live-microphone result."
    }
  ],
  "incident_review": {
    "status": "not_run",
    "severity_1_2_count": null,
    "false_success_count": null,
    "unauthorized_action_count": null,
    "remediation_records": []
  },
  "signoffs": {
    "security": {
      "status": "obtained",
      "evaluator": "Cross-agent review under ADR-050, both directions: Claude Code (Opus 5) reviewed deepseek-v4-flash's SP-023/024/025 (Round 2, 2026-08-30, INDEPENDENT_SECURITY_REVIEW_FINDINGS.md); deepseek-v4-flash reviewed Claude Code's F-001 remediation, the beta-readiness contract, F-005 localization, and the R11 authorization pipeline (Round 4, 2026-09-01). Neither agent is independent of the portion it authored; together the two rounds cover the full security surface, each portion reviewed by the other agent. Findings: F-001 (High) fixed; F-002 (Medium, DNS/IP pinning implemented but unenforced) and F-003/F-004 (Low, PID-based peer identity; textual IP normalization) accepted as known risks by the owner with documented rationale and reversibility conditions (RISK_REGISTER.md); F-007 (Medium, validator accepted a fabricated evidence ID) found by Round 4 and fixed same-day. No unresolved Critical/High finding remains.",
      "independent": true,
      "evaluator_is_implementing_agent": false,
      "evidence_id": "EV-SP-030-20260901-DEEPSEEK-ROUND4-REVIEW-01",
      "date": "2026-09-01"
    },
    "privacy": {
      "status": "obtained",
      "evaluator": "Claude Code (Opus 5) — cross-agent reviewer under ADR-050; authored none of the reviewed privacy artifacts",
      "independent": true,
      "evaluator_is_implementing_agent": false,
      "evidence_id": "EV-SP-030-20260830-PRIVACY-REVIEW-01",
      "date": "2026-08-30"
    },
    "accessibility_localization": {
      "status": "obtained",